{
  "$schema": "https://json-schema.org/draft/2020-12/schema",
  "title": "Parallel Slices architecture package",
  "type": "object",
  "additionalProperties": false,
  "required": [
    "$schema",
    "contractVersion",
    "id",
    "packageName",
    "version",
    "displayName",
    "description",
    "components",
    "capabilities",
    "options",
    "entrypointCapabilityFloors",
    "generator",
    "overlay",
    "verification",
    "templates",
    "projectDocuments",
    "controllers"
  ],
  "properties": {
    "$schema": {
      "type": "string",
      "pattern": "architecture-package\\.schema\\.json$",
      "anyOf": [
        { "$ref": "#/$defs/publicHttpsUrl" },
        {
          "allOf": [
            { "not": { "pattern": "^(?:https://|/)" } },
            { "pattern": "^[^\\\\\\u0000]+$" }
          ]
        }
      ]
    },
    "contractVersion": { "const": 1 },
    "id": { "$ref": "#/$defs/id" },
    "packageName": {
      "type": "string",
      "pattern": "^(?:@[a-z0-9][a-z0-9._-]*/)?[a-z0-9][a-z0-9._-]*$"
    },
    "version": { "$ref": "#/$defs/version" },
    "displayName": { "type": "string", "minLength": 1, "maxLength": 100 },
    "description": { "type": "string", "minLength": 1, "maxLength": 500 },
    "starter": {
      "type": "object",
      "additionalProperties": false,
      "required": ["repositoryUrl", "templateUrl"],
      "properties": {
        "repositoryUrl": { "$ref": "#/$defs/publicHttpsUrl" },
        "templateUrl": { "$ref": "#/$defs/publicHttpsUrl" }
      }
    },
    "components": {
      "type": "array",
      "minItems": 1,
      "items": { "$ref": "#/$defs/component" }
    },
    "capabilities": {
      "type": "array",
      "minItems": 1,
      "uniqueItems": true,
      "items": { "$ref": "#/$defs/capability" }
    },
    "options": {
      "type": "object",
      "propertyNames": { "$ref": "#/$defs/id" },
      "additionalProperties": { "$ref": "#/$defs/option" }
    },
    "entrypointCapabilityFloors": {
      "type": "object",
      "additionalProperties": false,
      "required": ["generatedBaseline", "preCommit", "prePush", "ci", "loop"],
      "properties": {
        "generatedBaseline": { "$ref": "#/$defs/capabilityList" },
        "preCommit": { "$ref": "#/$defs/capabilityList" },
        "prePush": { "$ref": "#/$defs/capabilityList" },
        "ci": { "$ref": "#/$defs/capabilityList" },
        "loop": { "$ref": "#/$defs/capabilityList" }
      }
    },
    "generator": {
      "type": "object",
      "additionalProperties": false,
      "required": ["module"],
      "properties": { "module": { "$ref": "#/$defs/path" } }
    },
    "overlay": {
      "type": "object",
      "additionalProperties": false,
      "required": ["directory", "requiredFiles"],
      "properties": {
        "directory": { "$ref": "#/$defs/path" },
        "requiredFiles": {
          "type": "array",
          "uniqueItems": true,
          "items": { "$ref": "#/$defs/path" }
        }
      }
    },
    "verification": {
      "type": "object",
      "additionalProperties": false,
      "required": ["module", "installedModule"],
      "properties": {
        "module": { "$ref": "#/$defs/path" },
        "installedModule": { "$ref": "#/$defs/path" }
      }
    },
    "templates": {
      "type": "object",
      "additionalProperties": false,
      "required": ["rootInstructions"],
      "properties": { "rootInstructions": { "$ref": "#/$defs/path" } }
    },
    "projectDocuments": {
      "type": "array",
      "minItems": 1,
      "uniqueItems": true,
      "items": { "$ref": "#/$defs/path" }
    },
    "controllers": {
      "type": "object",
      "additionalProperties": false,
      "required": ["cursor", "codex", "claude-code"],
      "properties": {
        "cursor": { "$ref": "#/$defs/controller" },
        "codex": { "$ref": "#/$defs/controller" },
        "claude-code": { "$ref": "#/$defs/controller" }
      }
    },
    "profiles": {
      "type": "object",
      "additionalProperties": false,
      "required": ["default", "definitions"],
      "properties": {
        "default": { "$ref": "#/$defs/id" },
        "definitions": {
          "type": "object",
          "minProperties": 1,
          "propertyNames": { "$ref": "#/$defs/id" },
          "additionalProperties": { "$ref": "#/$defs/profile" }
        }
      }
    }
  },
  "$defs": {
    "id": {
      "type": "string",
      "pattern": "^[a-z0-9]+(?:-[a-z0-9]+)*$"
    },
    "version": {
      "type": "string",
      "pattern": "^\\d+\\.\\d+\\.\\d+$"
    },
    "path": {
      "type": "string",
      "minLength": 1,
      "pattern": "^(?!/)(?!.*(?:^|/)\\.{1,2}(?:/|$))(?!.*//)(?!.*\\/$)[A-Za-z0-9._/-]+$"
    },
    "publicHttpsUrl": {
      "type": "string",
      "pattern": "^https://[^\\s/?#@]+(?:/[^\\s?#]*)?$"
    },
    "capability": {
      "type": "string",
      "pattern": "^[a-z][a-z0-9]*(?::[a-z0-9]+(?:-[a-z0-9]+)*)*$"
    },
    "capabilityList": {
      "type": "array",
      "minItems": 1,
      "uniqueItems": true,
      "items": { "$ref": "#/$defs/capability" }
    },
    "component": {
      "type": "object",
      "additionalProperties": false,
      "required": ["id", "kind", "technology", "optional", "attributes"],
      "properties": {
        "id": { "$ref": "#/$defs/id" },
        "kind": { "$ref": "#/$defs/id" },
        "technology": { "type": "string", "minLength": 1, "maxLength": 100 },
        "optional": { "type": "boolean" },
        "attributes": { "type": "object" }
      }
    },
    "option": {
      "type": "object",
      "additionalProperties": false,
      "required": ["type", "description"],
      "properties": {
        "type": { "enum": ["string", "boolean", "integer"] },
        "description": { "type": "string", "minLength": 1, "maxLength": 200 },
        "required": { "type": "boolean" },
        "default": { "type": ["boolean", "integer", "string"] },
        "enum": { "type": "array", "minItems": 1, "uniqueItems": true },
        "minimum": { "type": "integer" },
        "maximum": { "type": "integer" }
      },
      "allOf": [
        {
          "if": {
            "properties": { "type": { "const": "string" } },
            "required": ["type"]
          },
          "then": { "properties": { "default": { "type": "string" } } }
        },
        {
          "if": {
            "properties": { "type": { "const": "boolean" } },
            "required": ["type"]
          },
          "then": { "properties": { "default": { "type": "boolean" } } }
        },
        {
          "if": {
            "properties": { "type": { "const": "integer" } },
            "required": ["type"]
          },
          "then": { "properties": { "default": { "type": "integer" } } }
        },
        {
          "if": {
            "properties": { "required": { "const": true } },
            "required": ["required"]
          },
          "then": { "not": { "required": ["default"] } }
        }
      ]
    },
    "controller": {
      "type": "object",
      "additionalProperties": false,
      "required": ["initializeCommand"],
      "properties": {
        "initializeCommand": {
          "type": "string",
          "minLength": 1,
          "maxLength": 100,
          "pattern": "^[/$]parallel-slices-[a-z0-9]+(?:-[a-z0-9]+)*$"
        }
      }
    },
    "profile": {
      "type": "object",
      "additionalProperties": false,
      "required": ["description"],
      "properties": {
        "description": { "type": "string", "minLength": 1, "maxLength": 500 },
        "displayName": { "type": "string", "minLength": 1, "maxLength": 100 },
        "components": {
          "type": "array",
          "minItems": 1,
          "items": { "$ref": "#/$defs/component" }
        },
        "capabilities": { "$ref": "#/$defs/capabilityList" },
        "entrypointCapabilityFloors": {
          "$ref": "#/properties/entrypointCapabilityFloors"
        },
        "overlay": {
          "type": "object",
          "additionalProperties": false,
          "properties": {
            "excludeFiles": {
              "type": "array",
              "uniqueItems": true,
              "items": { "$ref": "#/$defs/path" }
            },
            "directory": { "$ref": "#/$defs/path" },
            "requiredFiles": {
              "type": "array",
              "uniqueItems": true,
              "items": { "$ref": "#/$defs/path" }
            }
          },
          "dependentRequired": {
            "directory": ["requiredFiles"],
            "requiredFiles": ["directory"]
          }
        },
        "templates": { "$ref": "#/properties/templates" },
        "projectDocuments": {
          "type": "array",
          "minItems": 1,
          "uniqueItems": true,
          "items": { "$ref": "#/$defs/path" }
        }
      }
    }
  }
}
